私は卓球が好きです。私は小学生５年から、高校３年生まで約７年間卓球をしてきました。卓球をよく知らない人は多く、実際に私の知り合いからも「何となく地味なイメージがある」などと言われた経験もあります。確かに卓球は、傍から見ると動きが少ないように見えて、地味に見えるかもしれません。ですがピンポンを目の前にしてラケットを握ると、その印象はがらりと変わります。瞬きの間にピンポンが飛び交い、台上で回転する球は予測できないような動きをします。卓球が最速のスポーツと呼ばれることがありますが、速度だけではありません。サーブする瞬間に少し手首をひねるだけで１８０度回転が変わり、それを見極めて対処するように打たないとすぐに負けてしまいます。どのスポーツにも言えたことかもしれませんが、以上の理由から特に卓球は非常に奥が深いスポーツだと思います。好きな選手は最近だと張本智一選手です。これからも応援していきたいです。,卓球
私の好きなスポーツは卓球です。中学生の頃から高校を卒業するまで、部活動でやっていました。私が部活動で卓球をしていたときは、卓球と言うスポーツは暗い人がするイメージがありましたが、近年の日本の卓球選手の頑張りのおかげで、イロイロな魅力が多くの人に知れ渡るようになりました。卓球はTVなどではわかりにくいですが、激しい打ち合いのみならず試合中の手首の動き1つで玉の挙動が大きく変わり、その動きに対応する反射スピードの速さなどが魅力の1つです。今後もオリンピック代表の石川佳純などの開拓組に長く頑張って欲しいと思います。,卓球
中学1年生のときに何気なく入ったバレーボール部、高校3年生まで続けましたがとても面白かったです。といっても最初は腕が腫れたり先生や先輩達の教えが厳しくて嫌だったのですが、練習を重ねるうちに自分がどのように動けばセッターと良い連携ができるかが少しずつ分かってきて、上達すればするほど好きになっていきました。バレーはひとりではできないスポーツで、みんなで協力し合って点を取るのが魅力的です。誰かがミスをしても他の誰かがカバーすることで得点につなげることができ、またそのようなプレーが試合の流れを大きく変えることもあります。他の球技の経験もありますけれどもバレーは特にチームワークが重要なスポーツだと感じました。ちなみに今のバレーボール界で好きな選手はVリーグ女子の古賀紗理那さんです。日本代表に入っている女子のエースで、東京五輪での活躍を期待しています。,バレーボール
わたしが好きなスポーツは、冬になるとよく中継されている【フィギュアスケート】です。エッジが氷を削る音や、優雅で美しい演技、きらびやかな衣装。1年の中で日本で観戦できるのが冬だけというのもまた来年の冬が恋しくなる、楽しみになる、そんな素敵なスポーツです。わたしが特に好きで応援している選手は、平昌冬季五輪の銀メダリスト、宇野昌磨選手です。宇野選手はどんな高い壁もものすごい努力で乗り越えてきました。まさに努力の天才を体現したような選手です。宇野選手の高い表現力や、滑らかなスケーティングは一度見たら虜になること間違いなしです。,フィギュアスケート
私が好きなスポーツは競輪です。少し前まで競輪に関わるお仕事をさせていただいていたこともあって出会ったスポーツなのですが、自転車を使うからそんな激しいものではないと思っていたのですが結構ぶつかったり、落車なんて日常茶飯事なことに驚きました。結構高齢男性のファンが多くてもさっとしている感じもしますが選手はかっこいいし女性が観に行くとすごくちやほやされておもしろいので、おすすめです。特に筋肉が好きな女性とかには最高の場所なのではないかなと思います。私が一番好きな選手は期待のルーキー和歌山支部の南潤選手です。,競輪
私はバドミントンが好きです。社会人になってから友達のサークルに入れてもらい、バドミントンのルールから覚えるような段階から始めていきました。バドミントンはシャトルの高速なやり取りからの駆け引きが魅力で、細かいフェイントを織り交ぜながらの、前後左右の揺さぶりからポイントを稼ぐのが基本ですが、日本のトッププレイヤーの桃田賢斗さんなどの動きは、そんな生易しい言葉では収まらない動きでゲームを勧めていきます。バレーボールより少し小さなコートを一人で支配するほどのハードなスポーツなのは、好きな人には大変魅力的だと思います。,バドミントン
私が好きなスポーツはずばり「相撲」です。相撲は日本の国技であり、だれもが一度はやったことのあるスポーツです。私が「相撲」が好きな理由は2つあります。1つは単純明快なそのルールです。基本的に徒手での打撃は禁止で、土俵から相手を出すか、相手の膝から上を地面につけるかというルールがとても分かりやすいからです。2つ目は小さいころからテレビで見ていたからです。NHKで大相撲をよく見ていました。今でも見ています。相撲には多彩な技があるのも魅力だと私は思います。相手と直接接触する組技やまわしを介した組技、さらにはかんぬきなどの極技などもあります。私が好きな力士は琴奨菊です。最近は負けが多いですが頑張ってほしいです。,相撲
好きなスポーツはフットサルです。学生の頃にサッカーをやっていて社会人になってからネットでメンバーを募集してチームを立ち上げて活動をしています。結婚して子供が出来てからも子供を一緒に参加させて、一緒にボールを蹴って楽しんでいます。フットサルの良いところは、性別も年齢も関係なく、みんなで一緒に出来る所です。サッカー経験者が初心者にそれなりに気を使ってプレイはしますが、経験者同士がマッチアップしたときは関係なくガツガツボールを奪いに行くことも出来るのも楽しいです。チームメンバーで親子で参加しているメンバーも多く、子供とお父さんとの対戦というのも出来るのもほのぼのとして良いスポーツだと思います。,フットサル
バスケットボールが好きです。身体能力が要求されるスポーツですが、チームスポーツとしての戦略性も高く、背の高さがあれば有利ではあるものの、小さい選手でも活躍していて、日本代表選手だと富樫選手のプレーは本当に凄いと思いますし、彼のパスやスリーポイントシュートは超一流のプレーとして観戦する価値があります。NBAのレジェンドプレイヤーも素晴らしくて、特にマイケルジョーダン選手のプレーはバスケットボールの神様と呼ばれることが納得できる超一流のプレーでした。豪快で跳躍力のあるダンクシュートも魅力的ですが、ここぞという時に得点をしてくれる勝負強さがジョーダン選手の魅力です。現役では八村塁選手が日本人としてNBAで活躍していることが誇りですし、彼のプレーは見ているだけで楽しいです。,バスケットボール
子どもの頃から好きなスポーツとして一番に思い浮かぶのがバスケットボールです。スラムダンクがジャンプで連載していた頃中学生だった身としては、その頃からNBAなどの痛快なダンクや華麗なパスワークなどに魅了されてきました。実際に行うと運動量の激しいスポーツではありますが、チームワークスポーツなので、チームメイトへのパスや遠くからのスリーポイントシュートなど爽快感は他のスポーツでは味わえないと思います。日本でも最近はプロリーグの人気が増え始めましたし、数年前まで想像もできなかったNBAの舞台で活躍する日本人も徐々に増え始めています。,バスケットボール
好きなスポーツは、水泳です。子供の頃から水泳を習っていましたが、水中に潜るとそこはいつもと違った世界なので、なんだかいつもと違う気持ちを味わうことができ、日頃のちっぽけな悩みなどどうでも良くなるところが好きです。泳げると溺れずにすみ、水難事故など有事の際に助かる可能性も高まりますし、ただ楽しいだけでなく、自分の役に立ってくれるスポーツであるところも魅力的だと思います。好きな選手は池江璃花子選手です。病気を告白された時は驚きましたが、克服し頑張られている姿はとても励みになり、自分も頑張ろうと思うことができます。,水泳
バスケットボールです。自分自身が10年以上してきたスポーツだからです。魅力は、ドリブル、パスの技術と目立つのはシュートですが、シュート前のアシストパス等も魅力の１つです。バスケットボールは、オフェンスとデフェンスの切り替えが早く、その中での双方の攻防がとにかく面白いです。ゴール下では、ポジションの取り合い、そこまでボールを運ぶガードやフォワードのパスやドリブルの技術等、魅せるところが沢山あるのも魅力の一つです。オフェンスだけでなく、デフェンスでコースを止めたりパスカットしたり、ナイスデフェンスを観るのも面白いとこです。好きな選手は、八村塁選手です。この選手のおかげで、バスケットボールもある程度世間に広まったからです。,バスケットボール
100メートル走には、何とも言えない魅力が詰まっています。わずか10秒程度で終わってしまう非常に短い競技ですが、この10秒の間にいろんな感動があります。現状の、世界記録は9秒58で、ここまで来るには相当な年月がかかりました。ある意味では、100メートル走の記録というのは、人類の歩みそのものであり、そこに大きなロマンを感じるわけです。好きな選手はやはり、現記録保持者のウサインボルト選手ですね。あんなに大きいのに、フォームがすごいキレイで、もはや芸術的です。羽が生えている、なんて表現をよく聞きますが、まさにそんな感じ。彼の記録を塗り替える選手は、おそらくは、私が生きている間は無理なんじゃないかな。,陸上
私が好きなスポーツは野球です。理由は小さな頃から関わっており、個人の力が無くてもチームの仲間と力を合わせれば試合に勝つことが出来るし、仲間と勝った時の喜びを分かち合える素晴らしいスポーツだからです。また1人では出来ないスポーツでみんなで1つの目標に向かって練習するので、どんなにきつくて諦めそうになっても仲間がいるので頑張れます。プロ野球選手で好きな選手は松坂大輔です。何故好きかと言うと、甲子園でエースとして大活躍していますが、そのほかにも野球を楽しんで笑顔でプレーしている姿がとても印象に残っています。また、決勝でのノーヒットノーランには鳥肌が立ちました。,野球
野球が好きです。野球は一人では成り立たないスポーツなのでチームメイトが団結してお互いをよく理解し時にカバーし合い勝利に向かう姿がとっても魅力的だからです。特に高校野球が大好きです。高校球児はとても純粋なのでプロよりも勝利を目指す懸命な姿勢と熱意を感じます。そしてピッチャーがコンディションが悪くなると他のメンバーがそれをカバーする為に懸命にプレーをしていてチームワークの良さを1番感じるスポーツだからです。私はイチロー選手が大好きです。あんなに凄い選手なのに常にトレーニングを怠らず自分に厳しく現状を甘んじないところが素晴らしいです。最初はそれほど注目されていない選手でしたが、努力の成果で世界レベルの選手にまで成長して、努力の大切さを教えてくれました人だからです。,野球
つい見てしまう「サッカー」の試合。熱心な家族の影響で好きになりました。日本代表でも、Jリーグであっても、応援しているチームが負けるとあからさまに不機嫌になり、家の中が不穏になるため、そんなことに関わり合いになりたくないですし、いろいろ気を遣うのが実は嫌で仕方がないのが実情です。しかし、その反面、ゴールを割った時の達成感はひとしおで、自分の事のように喜んでしまいます。サッカーの魅力は、団体競技なのにも拘わらず個人的な要素も溢れているところです。特に最近の代表選手は、小柄な人が多い反面、美形の人が多く、見ていて美しく楽しみです。南野選手や伊東選手、それに続く美形選手達が見て楽しめます。前のワールドカップ代表の選手層は大柄で個性的な人が多かったのですが、今回の人達は、小柄、美形。変人と言ったところです。リーダーシップをとれる人が少ないようなので、前メンバーの出所はそのあたりかと思っています。,サッカー
大人数でチームワークを学べるスポーツとして子供の頃から慣れ親しんできたのはサッカーです。キャプテン翼世代としては、現在ヨーロッパなどで当たり前のように日本人の選手が活躍をしている姿は嬉しい限りです。好きな選手は昔も今もメッシが一番です。サッカーの魅力の一つは、統一感だと思います。実際に1点を取る場合最後にボールに触れるのは1人ではありますが、そこに至るまで仲間が繋いでくれたという統一感は他の団体競技にはない楽しみ方になると思います。世界の競技人口もトップクラスのスポーツですので、ボールさえ持っていけばどこでも遊べるイメージがあります。,サッカー
陸上の長距離種目は、自分で走るのも、テレビで観戦するのも大好きです。実家の近くで練習していた大学が箱根駅伝に出場したのがきっかけで、長距離を好きになりました。箱根駅伝では毎年、シーズンベストなどをチェックしながら予想をするのが楽しみで、その熱に少し周りから引かれています。基本的には走るだけですから、細かいルールなどは何もありませんので、興味さえ持てば誰でも気軽に応援できるスポーツだと思いますし、家族と話しながらのんびり観戦できるのも魅力ですね。特に好きな選手は佐藤悠基です。30代半ばになりましたが、20代の選手に負けない力を維持しており、まだまだ日本陸上界を引っ張ってもらいたい存在です。,陸上
打った時の充実感が高いラケットスポーツとしては、ソフトテニスが随一だと思います。日本生まれの競技であることは一般の人にはあまり知られていないかもしれませんが、世界トップレベルの技術を長年維持している事は世界に誇れると思います。魅力の一つとしては、ラケットが軽いので体力に自信がない方でも続けることができます。好きな選手は船水選手で、彼の技術は世界で五本の指に入ると思います。また硬式テニスのボールは使い捨てですが、ソフトテニスのボールはゴム製の耐久力のある物ですので空気が抜ければまた入れなおすという具合に経済面でも長く使えます。,テニス
最近、野球に興味を持つようになりました。理由は何といっても大谷選手です。ピッチャーとバッターの両方で、トップレベルの実力を有しています。どちらかに専念すれば、サイヤング省、またはホームラン王をとれるほどの実力です。野球の常識をぶち壊すというか、ゲームや漫画の世界のことを成し遂げようとしているわけで・・。日本の若者が、本場アメリカでバリバリ活躍しているのを見るのは本当に面白いです。野球は、ルールも簡単ですし、ほかのスポーツと違ってのんびり見れるのも魅力ですね。ポップコーン片手に、映画を見るような感覚で毎回楽しませてもらってます。,野球
日本人にとって、手軽に遊べるスポーツとしては卓球だと思います。日本ではボーリング場やゲームセンターなどに当たり前のように設置されていますし、特に最近は長年高い壁だった中国選手に勝つような日本人が男女ともに出てきた事で競技スポーツとしての人気も出てきました。好きな選手は石川佳澄選手です。同郷ということで彼女が小学生の頃から応援しています。最近では人気が出てきた事によって、卓球教室も街中にチラホラ見るようになってきたり、ラケットのラバーなど専門店でしか買う事ができなかった用具も手軽に買えるようになったのが魅力の一つになりました。,卓球
ゴルフが好きです。そもそも父親がゴルフ好きで、毎週末はほぼゴルフ…父親がいなくて寂しい時もありましたが、何かしら景品をもらってくるので家族全員それを楽しみにしていました。その後私は社会人になり、いつか父親と一緒にラウンドしたい！と考え、中古のクラブを買って練習し…初めは全く当たらず、意地になって練習をしていましたが、当たり始めると飛ぶ！これは面白い！と虜になりました。結果、父親・私・私の夫3人でプレーすることができました。ゴルフは老若男女問わず楽しめるスポーツです。私の父は74歳になる今もラウンドしています。私は夏はアブに刺されて大変な思いをしたり、冬はゴルフ場に着いてから雪のためにクローズになり、でもどうしてもプレーしたくて他のゴルフ場を探して即移動してプレーしたり…ハマります！ゴルフだけではなく、ゴルフ場での昼食＆ビールも楽しみです。最近はやはり渋野日向子選手が気になります。,ゴルフ
サッカーです。特にサッカーのJリーグは地域密着型のリーグですし、身近に感じることも出来るのでより一層応援にも熱が入ります。また、サッカーの魅力は観客を魅力するパスワークだったり迫力のあるシュートだったり観ていて熱中出来ることですし、各チームにそれぞれ違った戦術があるので、その戦術での戦いかたの違いなども楽しめる要素だと思います。自分自身サンフレッチェ広島のサポーターをしていますし、中でも青山選手が好きで特に応援をしています。スタジアムでサポーター同士が一体となり同じチームを応援するのは格別ですし、素晴らしいです。,サッカー
にわか「ラグビー」好きです。ワールドカップ後のコロナ禍で、すっかりご無沙汰してしていますが(実際、通常のリーグ戦の試合の楽しみ方が分からない)、好きな選手、田村選手、福岡選手、姫野選手、松島選手、リーチマイケル選手と書き連ねていくと、何だか感動が蘇って、またあのような試合を見てみたいと思います。ラグビーの魅力は、何と言っても紳士のスポーツらしい品の良い試合風景です。バックグラウンドのグリーンをはじめ、キックしてゴールするコンバージョンゴールの景色が雄大で素敵です。トライでの特典もエモーショナルですが、このキックでのゴールの風景が一番ラグビーのスケールの大きさを表しているように思えます。なんだか盛り下がっているオリンピックですが、始まったら、祭りの前の静けさで、日本のみならず世界でも弾けそうです!,ラグビー
私の好きなスポーツはサッカーです。サッカー選手はかっこいいし、ルールわかりやすいから見ていて楽しいです。ゴールが決まるかどうかの瞬間のわくわく感はたまりません。いろいろなチームやユニフォームやグッズがあるところも楽しいです。サッカーは、オシャレを楽しみながらスポーツできるのも魅力的だと思います。ヘアスタイルやファッションなど真似したくなります。好きな選手は中村俊輔選手とメッシです。やっぱりシュートが上手な選手に憧れます。サッカーのシュートが決まる瞬間がめちゃくちゃ好きです。試合時間も長すぎないし短すぎないので、1試合見るとちょうどよく満足できるのがよいなーと思います。,サッカー
私が好きなスポーツはサッカーです。理由はまずモテます。特に学生時代は運動神経が高いという要素がモテる要因だったと思うので、多少ですが私も良い思いをさせて頂きました。またサッカーはチームスポーツなので人間関係の構築や協調性などの人間的成長が可能です。私は小学生の頃からサッカーをしていますが大人になった今でも、仲良く遊んだりしている友人はサッカー時代の友達が多いです。またサッカーは大学に入ってもサークルがあったり、社会人サッカーがあったり、Jリーグがあったりといわゆる趣味としても人生を充実させてくれるスポーツだと思うのでオススメです。運動不足解消にもなると思います。,サッカー
私は好きなスポーツはテニスです。理由はサッカーや野球と違い、チームスポーツではないので自分次第の努力で結果に直結できるので面白いですしモチベーションを保つことができます。幼少期はプロテニスプレイヤーを目指して習っていましたが大人になった今では、エクササイズのような感覚で定期的に体を動かしています。そういったスポーツだと思いますし社会人になってからもテニスきっかけで新しい繋がりができたので嬉しく思っています。好きな選手は海外の選手ですがナダルです。テニスプレイヤーとしての実力はもちろんですが、ルーティンが徹底されており生き方として学ぶことが多い選手です。,テニス
私は野球が好きです。子供の頃にイチロー選手の活躍を見てすごいなと思いそこから野球に興味を持ちました。見るのも好きですが実際に自分でプレーするのも好きです。バッティングで会心の当たりを打ったときの爽快感は堪りません。現在は見る方が多いですがテレビで見ていても鍛えられたプロのプレーは迫力がありすごいです。同じ人間なのにあんなに早い球を投げれるんだとかあんな飛距離出るんだとか感心しながら見ています。やはり最大の魅力は終盤の緊迫した場面での投手と打者の駆け引きですかね。ここで打てば試合に勝てるという状況なので手に汗握りますしお互いの選手の緊張感が伝わってくるのがいいです。,野球
