サッカーの代表戦などをみるのが好きです。サッカーがすきな理由は、いくつかありますが世界のスポーツであるから国別対抗の争いがおもしろいからです。また、違う人種が同じフィールドでぶつかりあうのが興味深いからです。アジア代表のような体格で劣るチームでも、技術や戦術によって格上に勝利することができるという意外性をみれるからです。あとは野球やバスケットボールは始める前に勝敗がなんとなく予想できるが、サッカーは番狂わせがおこりやすくてハラハラするからです。あと足でものをけってゴールにいれるというスタイルが、野球などより人間の原点をイメージさせるから。,サッカー
私がサッカーを好きな要素はまず、誰でもボールさえあればできるということです。ほかの競技はさまざまな道具がないとできないものが多いですが、サッカーはボールだけなので公園でも出来るし、練習も1人でできます。また、頭を使いながらやるという点も好きな要素のひとつです。ポジションが流動的なので、自分がどの位置に居たら相手にとって邪魔か、どの位置にいたら自分たちの得点に繋がるのかを考えるのが面白いです。そのために個人技を磨いたり、過去の試合を見たりする時間もとても有意義で楽しいです。このようなただ体を動かせばいいと言うだけでなく頭を使いながらやる所が好きです。,サッカー
"私にとってサッカーの魅力は、個々の身体能力が見事にマッチして、チームプレイが一つの壮大なパフォーマンスに見えるところです。
どんなに一人一人の能力が素晴らしくても、決して仲間同士がお互いのことを分かり合えていなければとても敵とは戦えない。それは他のスポーツでも言えることかも知れませんが、お互いを理解し、次の動きを予想してパスを回していく一連の動作は、まるで芸術作品のようにも思えるのです。
たとえ点に結びつかなかったとしても、その流れるようなパスワークが見れた時は心が揺さぶられます。
上手下手関係なく、チームメイトと信頼しあいながら楽しめるということがスポーツでは大切ではないでしょうか。ぜひたくさんの子供たちにもプレイしてもらいたいです。",サッカー
サッカーは小学校低学年の頃から仲の良い友達同士で公園でやっていました。ただし、自分は体力的に弱いところがあったので本格的なサッカー部に入るのは断念して、もっぱらサッカー観戦するようになりました。サッカーの好きなところはゴールにシュートを決める姿が格好いいからです。Jリーグやワールドカップなどのサッカーの試合を観て、サッカーを魅力的に感じるのはゴールするまでに頭脳的なプレーでパスを繋いでゴール近くまでいかにしてボールを持っていくかです。ゴールキーパーが必死にシュートを阻止しようと体を張って止める姿も魅力的です。好きなサッカー選手は三浦知良選手です。54歳になった現在も現役という姿に勇気づけられるからです。,サッカー
"私がサッカーが好きなところは比較的同年代の女性が多くファンにいるところです。
おかげでサッカーについて友人と語りたい時にもサッカーなら同性に話す時でも引かれないのが良いです。

それどころかサッカーについて一緒に楽しく語れる同性が多いのが良いと思っています。
また家族も子どもがサッカーが好きというのもあってサッカーを通してコミュニケーションを取れるのも良いと思っています。

特にサッカーはイケメン選手が多いという点でもかなり魅力があると思います。
そのおかげでより一層応援したいという気持ちになれるのもサッカーはが好きなところです。",サッカー
"それでは、サッカーが好きなところを端的ではありますが述べさせて頂きます。
①『なぜサッカーが好きなのか』…個人的に一番プレーしていて楽しいと思えるスポーツだからです（技量はありませんが）。プレーしても楽しい、見ても楽しいと、メリットしかない気がします。
②『サッカーの魅力について』…なかなか点が入らないところだと思います。試合終盤や土壇場での逆転シュートなどは思わず飛び上がるほどに興奮します。あとは、愛国心が芽生えることです。ワールドカップはその象徴で、まさに国一丸となって戦う姿は感動モノです。
③『好きなサッカー選手』…スペインリーグ・ビジャレアルの【久保建英】選手です。野球の【大谷翔平】選手同様、世界を驚かせてくれる逸材だと思います。彼らの活躍は、生きる勇気や活力を与えてくれます。",サッカー
サッカーというスポーツの最大の魅力であり最も興味がひかれる理由は、世界中で広く愛されているスポーツであるということです。ボール一つあれば貧富も人種も関係ありません。ヨーロッパの小さな国でもしっかりと強いし、南アメリカ諸国はもちろんテクニックに優れ、アフリカ諸国も強靭なフィジカルを生かした面白いサッカーをします。日本を含めたアジア諸国も規律あるサッカーでしばしば世界を驚かせています。多くのスポーツの頂点がオリンピックであるのに対して、サッカーはワールドカップという世界最大の祭典があります。このワクワクする大会こどが私がサッカーを好きな最大の理由で、それがおそらく世界の誰もが感じていることでしょう。私の好きな選手はポルトガルのクリスティアーノ・ロナウドです。,サッカー
サッカーは日本だけでなく、世界的に最もメジャーなスポーツであり、ヨーロッパ、南米、アフリカ、アジアといった各国で盛んで、国同士が戦う国際試合の面白さも大きな魅力です。国を背負って戦う代表選手同士の戦いは本当に激しくて、特にワールドカップ本戦の試合はどの試合も白熱してとても面白いです。世界中のプロリーグも盛んで、特に世界の名選手が集まるスペインリーグはレベルも高くて面白いです。世界一のプレイヤーと言われるメッシ選手の試合は素晴らしい個人技を目の当たりにすることができ、彼のプレーだけで興奮しますし、実際にスーパープレーで得点もしてくれるので、見ているだけでワクワクすることができます。日本人もヨーロッパリーグで活躍しており、世界を舞台にしたスケールの大きさもサッカーの大きな魅力です。,サッカー
"サッカーが好きな理由はボール1つを巡り、多くの選手が走り、そのボールを奪い合うところが迫力あって好きなところです。あんなに広いグラウンドを走り、ジャンプし、ヘディングまでしてボールを仲間に繋いでいき、ゴールをするあの瞬間はドキドキと興奮します。

ゴールしそうなのに敵チームにとられてしまい、なかなかゴールできない。でも、選手の粘りと根気でまたゴールを目指すあのチームプレイと協力をし合う姿には感動します。

また、サッカーはドリブルの早さと瞬時に誰にパスすればよりゴールに速く、的確にボールを持っていけるかを選手が判断し、パスするその瞬間が魅力的。

そんな私の好きな選手は佐々木翔です。周囲を観察する力が他の選手よりも格段にあり、次にどうパスすればいいかを瞬時に判断できる能力を兼ね備えているなと思います。",サッカー
"様々な球技があるが、最も男らしいのはサッカー。
バスケとバレーは、背が高ければ圧倒的に有利なスポーツのためフェアではない。
テニスとバレーは、ネットで見方と敵が別れているため、ラフプレイになることは滅多になく盛り上がりに欠ける。
野球とアメフトはラフプレイもあるのだが、いずれも防具を付けて行うため男らしくない。
その点、ラグビーは男らしく見えるが、汗をかいた男同士でスクラムを組むのは見ていて不快。
サッカーは防具を着けず、時にはラフプレイに発展することもあり、見ていてワクワクする。
バスケ・バレー・野球・アメフト・ラグビー、これらはいずれも手を使う球技、一方、サッカーはキーパー以外、手を使わない。
プレイでは手を使わなくても試合後には敵と握手する、それが女の私には堪らず毎回キュンキュンさせられる。",サッカー
サッカーはやる方も見る方も大好きです。スポーツの中でも一番好きです。Jリーグが発足する前の、代表がアジアでも全然勝てなかった頃から大好きでした。サッカーは他のスポーツと違い、頭を使えば身体能力がなくても上手くプレーできる所が非常に好きです。一流のプロレベルになるともちろん違いますが、普通にプレーするレベルの話だとプレーレベルの自由度が非常に多く、頭とコツ次第ではボール扱いが全然上手くなくても活躍できます。それがわかった瞬間がまた楽しくて、それを研究するから観戦するという楽しみもあります。考えてプレーするもよし、本能のままプレーするもよしで、とても楽しいスポーツだと思います。好きな選手は、私がGKでプレーするのが好きなので川口能活選手が大好きでした。,サッカー
"サッカーが好きなところは上手い人が際立つ球技という点です。
上手い選手がボールを持つとずっと1人でボールをキープできたりするので見ていてかなり爽快感があります。

その点がサッカーの良いところだろ思っています。
またそれでいてチームの調和も保つ必要があるので独断でどんどん進めれば良いわけでもなくちょうど良いタイミングで味方に上手くパスするのも才能なので
そこでさりげなく上手くパスを出す選手を見るとかっこいいと思えるので自信の技術とチームメイトへの配慮ができる選手を見て素敵な選手を見つけるのが何気に楽しかったりするのもサッカーの魅力です。",サッカー
"サッカーの観戦が好きです。
現在のコロナ環境下でスタジアムに行って大声を出したり、歌ったりすることができないのは悲しいし
人がほとんど入っていない映像がテレビから流れるのを見るのは残念でたまらないです。
なぜ好きかというと、スタジアムで友人や同じチームを応援する人たちと空間を共有できるのが楽しい。
応援するチームのゴールが決まると。興奮して見ず知らずの人とハイタッチをしたり抱き合ったりする。
こんなことは日常生活の中ではありえない。
お気に入りの選手はベテランの域に達している遠藤保仁が好きです。
残された現役の時間は少ないと思うが、長く頑張ってほしい。",サッカー
世界中のサッカーファンとリアルタイムで盛り上がれるところが、サッカーの魅力であり好きなところです。個人的に、元リバプールのスティーブン・ジェラード選手が好きだったこともあり、有料ではありますが海外の試合を配信しているサイトに登録しており、今でも注目の試合は、時差の関係で眠い目をこすりながらもリアルタイムで観戦しています。そうすると、世界中のファンと一体となって、チャット等で繋がりながら応援することが出来ます。そのようなことが出来るのも、ボール1つあればプレーすることができ、世界的に人気の高いスポーツであるサッカーならではかと思います。,サッカー
サッカーは世界で一番メジャーなスポーツでもあり、一番単純なスポーツでもありますが、そこが奥深くて面白いところでもあり、やる方も見る方もその点で引き込まれるので非常に好きです。ボール扱いやテクニックの凄さ、身体能力の凄さ、走力やチームの一体感も楽しめますし、数多くのドラマを生むスポーツでもあります。世界中で楽しまれているので地域ごとに特色がでるのも面白いですし、スポーツの中でも一番真剣身が出て、本当の真剣勝負を味わえるのも醍醐味の一つだと思います。特にワールドカップは歴史がありオリンピックよりもメジャーな大会として位置づけられる真剣勝負で大会ごとに非常に楽しみです。好きな海外の選手はたくさんいますがブラジルのロナウドの全盛期がものすごくて、今でも忘れられないくらい好きでした。,サッカー
"ボール一個あれば他に道具がいらず、いつでもどこでもできるスポーツであること、だからこそ世界で最も普及していて、世界中の人と盛り上がれる点が大きな魅力です。
ほとんどの国が本格的な代表チームを持っているので、ワールドカップ予選や、ヨーロッパ、アジア、南米等の各選手権における盛り上がりが半端じゃなく、他国同士の試合でも注目して見てしまいます。
ワールドカップはその集大成で、地球上最大のスポーツイベントだと思いますね。
また、他の球技と比べると「オフサイド」の説明が少し難しいぐらいで、基本的にシンプルなルールで構成されていて、初心者にもとっつきやすい点が良いところです。
現役で好きな選手は三浦知良選手です。私の父親ぐらいの年齢ですが、そのストイックさは見習う点が多いです。",サッカー
"私はスポーツの中で1番サッカーが大好きです。
サッカーはまずやっている人が多くて世界中で
愛されているスポーツだと感じます。
サッカーはボールが有ればすぐにできるし、点数は
一点しか入らないので複雑ではなく、とても見やすい
スポーツだと思います。
サッカーは得点を奪うだけが全てではなく華麗な
テクニックや驚くようなドリブルもあって
人を魅了する事ができるスポーツだと思います。
私が1番好きなサッカー選手は本田圭佑選手です。
日本代表としても活躍して世界的にも実力のある選手だと
認められています。
カリスマ性もあって素晴らしいプレーをしてくれるので
ずっと見ていても全然飽きません。
これからもずっとファンでいたいなと思います。",サッカー
"サッカーはルールがわからないという人が結構いるけど、一部分ずつ覚えていくとみるのが本当に楽しくなる。ボールを持っている人だけでなくて、持っていない人の動きも注意深く見ていると意味があったりその先の攻撃につながったりする。
またサッカーはアイドルと違って毎日の練習を見守ることができるので、選手に愛着がわきやすくチーム全体を好きになれる。
毎日継続してみていくことで成長もわかりやすい！できないことを何度も何度も練習して、少しずつ成功するようになって、試合で成功したときには感動するし、応援している自分も頑張ろうと思えます。",サッカー
"どんな国の人、年代の人でも簡単なルールを覚えればすぐに始められるのがサッカーの魅力です。それに、他のスポーツよりも喜怒哀楽が出るスポーツで、サポーターが一丸となって楽しめる。

気持ちを歌に込めて応援できるサッカーは勝つと心から喜べるスポーツです。より愛国心を表現し、感情に込めて出せるのもサッカーならでは。

また、お洒落好きも納得できるウェアもお洒落で格好いいのも魅力的で好きなところ。

簡単にプレイしてるようで、監督の戦術がよくマスターし、出すチームはとくに格好いいし、惚れてしまいます。

あと、サッカー選手で好きなのは堂安 律です。表情にあまり辛さというものを出さず、黙々とプレイをするところが格好いいです。彼はドリブル姿に乱れがなく、一度決めるとそこへ迷いもなくパスできるところが男らしく、好きです。",サッカー
サッカーの好きなところは「個人技とチームプレーの融合している」ところです。選手に能力があっても、チームプレーができていなかったり、監督の手腕が悪かったりすると、モロに試合に出てくるところが観ていて面白く感じています。サッカーは、プロの試合を観ることが面白いだけではなく、サッカーボールひとつだけあれば、子供と蹴り合いして遊ぶこともできるのもサッカーの好きなところでもあります。蹴るだけでいいので、小さい子供でもできるスポーツだと感じています。スポーツの中でもボールひとつあればできるのはサッカーだけじゃないかなと思っています。,サッカー
私はサッカーが好きです。理由は2つあります。まず１つ目は皆で盛り上がれるスポーツだからです。特に、4年に一度開催されるワールドカップは、スポーツバーなどで観戦すると周りのサッカー好きな方々と一緒に盛り上がることが出来ます。2つ目の理由としては、日本人選手が海外に挑戦しようとするチャレンジな姿勢を見ることが出来るからです。これは私にとっての魅力でもあります。例えば、最近で言えば、私が応援している南野選手(現サウサンプトン)が世界最高峰のリヴァプールというチームで奮闘する姿には心打たれました。他の外国人選手とはフィジカルの差や言語の壁がある中で奮闘する姿は素晴らしいと思います。それを見て、私も普段の仕事を頑張れています。,サッカー
"私がサッカーにハマったのは2004のチャンピョンズリーグ、リバプールが逆転優勝をした試合を観戦していたことからでした。その時の主将でありジェラード選手は私のアイドル的存在でした。
サッカーは得点が入りづらいスポーツですが、だからこそチームが組織的に連動してゴールが産まれた瞬間は他には代えがたい興奮や感動が得られると思います。
中でも私がサッカーで好きな瞬間は、いくつものパスを繋いで相手の守備を掻い潜りゴールを奪うシーンです。現代サッカーは非常に組織的であり戦略的にになっていますが、
その戦略の中で選手がとっさに閃いたアイディアを表現し、それを味方が理解し連動する姿は、練習から積み上げたものの発露であり、努力が報われる瞬間として非常に感動的です。",サッカー
サッカーというスポーツはもう歴史があって日本でしJリーグが発足してからかなりの年月が経ち面白い点はやはり戦術とか監督がどうやってやっていくのか楽しみな所は足だけでやるスポーツでやはりシュートシーンは格別で海外サッカーもスタイルが皆違ったりしていてワールドカップなどは国を背負って戦うのでとても見ごたえがありjリーグも自分は三浦知良が好きでして一時代を背負ってきたプレーヤーで今なお現役としてやっている所が好きでサッカーの醍醐味はパスをつないでいったりとかポジショニングなどを見ています。雨の日も雪の日もするのでとてもすごいと思います。,サッカー
サッカーは、地域色が強いところが好きな点です。千葉のように同じ県内でも複数のプロチームがあり、より深い地元愛でチームを応援することが出来ます。個人的に好きな選手は昨年引退した増嶋竜也選手ですが、複数回移籍を経験した増嶋選手も、最後は地元のチームで終えたいということで、悩んだ結果ジェフ千葉での引退を決断したそうです。選手もそのような思いを持っているので、ファンの方も、自分が生まれ育った地元や、いま住んでいる街のチームを応援することが多く、その愛は深まります。そのような魅力があるところが、私がサッカーを好きなところです。,サッカー
ずばり、個人技の美しさと、各プレーヤーが一緒にプレーして、ゴールするまでの、ボールの流れにあると思います。選手同士のプレーの連携が生み出す個々人の技術からうまれるゴールシーンはみものです。また、メッシなどの特質される選手のボールの扱いついては、「あんなプレーができる」のかと、感心、驚きさえ生まれます。サッカーはサーム戦です。そして、個人スキルの高い選手は、おのおののポジションをそつなくこなします。そして、個人スキルの高い選手がそろったチームには、選手を動かす監督の戦術が必要になります。もちろん、そこには相手チームの戦術の裏をかく、監督の技量が発生します。美しいプレーからうまれる試合感がサッカーの魅力です。,サッカー
"サッカーはバスケや野球など他のスポーツとは違い1点を取りにいく時、大きなコートを11人でパスを繋ぎながらじっくり攻めていくスポーツなので展開がとても大事でじわじわゴールまでボールを詰めていくところが私はサッカーの魅力でもあり大好きです。
サッカーの試合を観ていると選手がみんな楽しんでプレーしていて見てる側もわくわくしながら観戦出来ます。
どのサッカー選手も大好きですが私はやはりゴールキーパーの
川島 永嗣選手が大好きです。
点数を許すとゴールキーパーのせいになりがちですが川島 永嗣選手はそのプレッシャーにも負けず必死に日本のゴールを何度も守ってくれました。その精神力とあの気迫に満ちた表情はサッカーを観戦する人の心を揺さぶります。
こんなにも熱くなれるサッカーは本当に凄いと思います。",サッカー
わたしはサッカーが好き。ジュビロ磐田が身近で応援しています。なぜサッカーが好きなのかというとひとつは観戦していても楽しいから。あの独特な気持ちよさ･･･これは野外の開放感ですね。それからその場の空気感。健康的というかすがすがしいですし、贔屓の選手が出場している時なんて時間を忘れ夢中になってしまいます。サッカーの魅力は「自由」でしょう。攻めても守ってもいい自由がサッカーの魅力。選手それぞれの魅力がよく分かるスポーツです。フィールドの中ならどこに行っても良いですよね。自由さを感じられるサッカーは見ているこちら側の気持ちも解き放してくれます。好きな選手は遠藤保仁。年齢的にきついとは思うが才能がありまだまだ期待できるでしょう。,サッカー
私はサッカーはプレイをするのではなく、観戦するのみですが、試合が白熱するとスタジアム全部で盛り上がる雰囲気が大好きです！家族もみんなサッカー大好きで、観戦も、プレイもしますが、特に主人のサークルの練習試合を見に行って家族みんなで応援するのが楽しいです！家族の一体感、会場の一体感、子どもととにかく盛り上がり、がんばって活躍している主人を子どもも尊敬するようです。うまくなくてもみんなで楽しめ、観る人もプレイする人も一緒に楽しめるところがサッカーの魅力だと感じます！サッカー好きがもっと増えると嬉しいと思います！,サッカー
