5年連続日本一の福岡ソフトバンクホークスのファンなのですが、パ・リーグは実力が拮抗していますし今年はどこが優勝してもおかしくない位のレベルだと思っています。150キロを超える剛速球のピッチャーも増えてきましたし、それを豪快にホームランにする実力のあるバッターもパ・リーグにはたくさんいると思っています。そのプレイを球場まで見に行くのが何よりの醍醐味ですし、今では地上波の放送は少なくなってきましたがスカパーやDAZNなどと言うサブスクも充実していますし開始から試合終了までを自宅の大きなテレビで見ると言うのももう一つの醍醐味だと思います。冒頭に書いた通り熱烈なソフトバンクファンです、1番応援してる選手は怪我から復帰した今宮健太選手です。今年は年間通してプレイしてくれることに期待しています。,野球
私の好きなスポーツは野球です。プロ野球をよく見ますが、好きな選手は阪神の佐藤輝明選手です。野球の好きな部分、魅力的な部分ですが、まずは自分が選手としてプレイした経験から言えることがあります。それは、バットにボールが当たりそのボールが糸を引くように外野に飛んでいく時の爽快感を体験できる、という部分です。この爽快感はライナー性の打球の時に特に感じられます。バットの中心にうまくボールが当たった時などはほとんど腕に衝撃がこないにもかかわらず、ボールが驚くほど遠くに飛んでいくことがあります。この感覚を味わうのがとても好きです。また、野球は観戦する魅力もあります。特に好きな部分は、球場で周りの観客たちと大声を出して応援歌を歌えるという点です。バッターごとに応援歌を変えて歌うのはとても楽しいです。,野球
父親の影響で小さい頃から野球のファンです。小学校から甲子園はいけませんでしたが、高校まで野球を続けていました。野球の好きなところと言えばとにかく物心ついた時からとにかく夢中になれるスポーツは野球しかないと言う感じだったと思います。そこまでうまいと言うわけでもありますせんでしたし、甲子園に出れると言う強豪校でもありませんでした。一応スタメンで5番ショートでした。社会人になってからは全くプレイはしていませんが、プロ野球のほうは今でもずっとテレビで見たり球場に観戦に行ったりはしています。小さい頃の長島さんが監督だった時代からの巨人ファンで、今でもずっと巨人一筋で応援しています。過去を上げると好きな選手はキリがないですが、今応援している選手は1番と言われれば坂本勇人選手になると思います。,野球
"野球といえば「日本で一番メジャーなスポーツ」という印象です。
プロ野球の歴史も大変長く、「王」、「長嶋」を始めとした数多くのスターが生まれてきました。
他のスポーツと比較して１試合にかかる時間は長く、知人や家族と一緒にゆっくりと観戦できるのが良いですね。
また、プロ野球に至っては国内の他のスポーツ選手と比較しても「高給取り」が多く、夢があるスポーツと言えますね。
もう一つ野球で好きな点は、やはり「高校野球」になります。
春と夏に行われる大会で高校球児たちの頑張りを見ることで、勇気をもらい、日々の生活に張りをもたらしてくれます。",野球
物心がついた時から、地上波でプロ野球を放送していましたし漫画でもスポーツと言えば野球がジャンル的に1番多かった感じがします。そのような環境で育ったので自然と野球は好きになりましたし、小学校から中学卒業までですが実際にやっていました。セ・リーグとパ・リーグ合わせて12球団日本全国にまんべんなく球団がありますし、春から秋まで年間を通して各球団が日本一を目指して熾烈に争うのはとても見ごたえがあると感じています。個人的には日本ハムのファンで不動の4番、中田翔選手を応援しています。戦力的に今年も厳しい感じですが何とかAクラス以上は頑張ってほしいと思っています。,野球
40代の女性なのですが、昔に比べてプロ野球選手自体のレベルも上がっていると思います。その理由は野球のレベルもそうなのですが、とにかくイケメンの選手が多くなった感じがしています。野球自体はプレイした事は無いのですが、とにかく球場に行っておいしいものを食べながらお酒を飲んで野球観戦をするのがここ5年位は自分自身の1番の趣味になっていると思います。福岡県出身でソフトバンクホークスを応援しているのですが、とにかくホークスの選手はスタイルも良くイケメンの選手が多くて応援のしがいがあります。その中でもイチオシの選手は、やっぱり豪快なホームランを打つ柳田悠岐選手です。今年も戦力が整っているので5年連続日本一になってくれると信じています。,野球
団体競技にはつきものですが、やはりチームメイト９人が一丸となって勝利を目指すところが最も好きなところです。バッティングに関しては、打率や出塁率など個人のバッティング技術の結果がデータとして残りますが、実際は１番から９番まである程度バッティングの役割を担っているので、完全に個人の自由裁量でプレーできるわけではありません。ピッチングに関して個人の技術に頼るところが大きいですが、中継ぎ投手や抑え投手にいかに上手く繋げていけるかが勝利のためには重要な戦略となります。このように、個人個人が最大限の能力を発揮して勝利に向けて頑張ることができる野球が好きです。,野球
野球は興行としての部分もあるところが面白く、引き分けのルールは時勢によって何度か変化しており、今後も固定されることはないでしょう。1988年10月19日の近鉄ロッテ戦の引き分けは非常にドラマチックでした。また、プロスポーツの中でも試合数が多いこと、代打や投手起用で個性が現れることから監督の存在が非常にクローズアップされるところも面白く原辰徳監督、工藤公康監督など個人的に好きな監督となっています。選手のパフォーマンスとしては西武ライオンズ時代の秋山幸二選手のホームランを打った際にホームベースに到着する際のバック転をするシーンが好きでした。,野球
"160km/hにも迫るストレートで相手バッターをばったばったと三振に討ち取る豪腕ピッチャーがいるかと思えば、ストレートは140km/hそこそこ、にも係わらず変化球のキレやコントロールで強打者を翻弄する技巧派ピッチャーもいる。そんな投手同士の投げ合いは、派手さは無いが片時も目が離せない。
一方で、大差を空けられた試合で稀によく発生する大逆転劇。そんな時によく見られるのが両軍入り乱れての大花火大会。やっぱりホームランは野球の華である。
しかし、たとえホームランが出なくとも、たとえ1本のヒットが出なくとも、足だけで点をもぎ取ることが出来るのもまた野球。ひとつの盗塁が試合の行方を決めることもある。
なんと楽しいゲームであることか！",野球
"私の場合、野球が好きな理由は、一回から九回までの試合の中で、人生ドラマのように、様々なドラマが展開される興味深さがあるからです。
また、９人でする競技なので、個人ごとの打撃の調子や、投手のその時の調子に試合展開が繰り返され、手に汗を握る試合の連続だからです。
そして、試合の結果に私も自分自身の様に、一喜一憂し、野球の本当の醍醐味を実感できるからです。
私の好きな選手は、元大リーグのイチロー選手です。
彼は、幼少の頃から、父親から、野球の洋才教育を受け、小学校からプロで活躍するまで、天性の才能と、超越した運動神経に恵まれたスーパースターでした。
私は、彼から、「人としての行き方」を学びました。",野球
"私は幼い頃から野球が大好きです。夕方になると、テレビの前に祖父、父、兄が集まり、ナイター中継を見ていたからだと思いますが、気が付いた頃には野球、特に中日ドラゴンズが大好きでした。
野球の魅力は、なんといっても格好いいところです。バットを構える姿、野手がボールを追う姿、キャッチャーのミットを構えた体の大きさ、誰のどのシーンを切り取って格好いいと思います。特に、打者がバットでボールをミートする瞬間の、ほんの一瞬の時間が、たまらなく痺れます。私は中日ドラゴンスの高橋周平選手が好きなので、今シーズンも応援したいと思います。",野球
野球好きの仲の良い友達と一緒に草野球をしています。私含めて全員が経験者ですが技術的には特に上手でもなく、みんなどんぐりの背比べです。ただ、他の草野球チームと対戦するときはみんな一生懸命ですし、負けていてももみんなで助け合いながら最後まで戦っているととても面白いです。野球は子供の頃から漠然とした感じで好きでしたけれど、年齢を重ねてからは1球ずつ真剣に勝負できるのが魅力的に思うようになり、さらに好きになりました。もちろん下手な私にも相手のピッチャーは1球1球を真剣に投げてくれます。ちなみにイチローさんが好きです。子供の頃にもらったサインを今でも家宝のように大切にしています。いつか私も彼みたいに上手になることができれば良いのですが。,野球
　私自身は野球をプレーしないのですが、高校時自分の学校の野球部が甲子園に出場したのをきっかけに野球の応援にはまりました。同級生とテレビや新聞の結果を見て盛り上がった時はとても面白かったです。大人になって同級生と疎遠になった今でも、家族と近所の球場に観戦に行きます。全く知らない人同士で一緒に一つのチームを応援する感覚がとても好きです。ほかのスポーツにはない独特の応援方法なのでそれがおススメです。野球選手の名前やチーム名がわからない人でも隣の人の真似をして大声で応援すると楽しめると思います。今の主人と出会ったのも仕事帰りに観客席で出会ったので野球は大好きです,野球
"野球を好きになったきっかけは高校生の時野球部が春のセンバツに出場して、甲子園まで行き応援をしました。
その時に延長戦になり、点を取ろうとなんとか塁に出ようとしたり、それを阻止しようと必死に守っている姿に感動しました。それからは、プロ野球を見るようになりました。当時は長嶋監督率いる巨人がピッチャーは投げては抑え、打線も１番から繋げては点を取り強力打線でとても強くすぐに巨人ファンになりました。
野球は全員野球で個人プレーでなくてチームのためにと選手それぞれがプレーしていて、９回２アウトまで何があるかわからないところが魅力です。
今は巨人の坂本選手が好きでコロナになるまでは毎年球場まで行き巨人を応援しに行ってます。",野球
福岡で生まれ育った私は、物心ついた時からホークスが身近で、知らず知らずのうちに応援歌を覚え、常にテレビで見ていました。そんな中自然と野球のルールを覚え好きになりましたが、その魅力はなんと言っても、ルールの奥深さだと思います。体力、技術だけでなく、頭の良さを求められるスポーツであり、日本だけでなく世界中の多くの人の心を掴んでいて、コミュニケーションツールとしても役立ちます！私が一緒好きな選手は大谷翔平です。日本にいたときに観戦したのは一度だけですが、テレビで活躍している様子を見ると、私もとても元気が出ます！！,野球
7?8年前に広島近辺に引越してきました。仕事は外回りをする営業職ですが、そこで驚いたというか、やはりというか、カープの話題がよく出てきます。男性はもちろんのこと、女性でもカープの話が挨拶代わりに出てきます。地域と密接に関係しているのがよく分かりました。元々スポーツ観戦は好きでしたが、カープファンと接していくうちにすっかりカープファンになってしまいました、野球の良いところは、シーズン中ほぼ毎日試合がある事です。なので「昨日の○○は?」とか「今日の先発は?」といった話題に事欠きません。現在のカープファンの間で話題になっているのが菊池選手。今年は序盤から打っているので「一体どうなってんの？」と今日も楽しませてくれます。,野球
"それでは、野球が好きなところを端的ではありますが述べさせて頂きます。
①『なぜ野球が好きなのか』…父親が好きで、その影響もありますが、ドラマ性を感じるからだと思います。プロ野球・大リーグ・甲子園など、クオリティーに差はありますが、ドラマ性だけは共通して高いものを感じます。
②『野球の魅力について』…ピッチャーとバッターの心理的な駆け引きが魅力だと感じます。お互いどのような感情を抱きながら対峙しているのかを想像すると、ドラマ性がグッと増していき、目が離せなくなります。
③『好きな野球選手』…大リーグ・ロサンゼルス・エンゼルスの【大谷翔平】選手です。彼の活躍を見るのが毎日の楽しみです。先日の【リアル二刀流】はシビレました。全世界が注目する選手の活躍は、生きる勇気や活力を与えてくれます。",野球
野球が大好きで、プロ野球はもちろん、メジャーの試合結果もチェックしています。そして、高校野球も。高校野球は、プロとは違った魅力があって、ついつい見てしまうんですよね。力強いバッティングでもなく、相手をほんろうするような変化球でもなく、優れた守備でもなく、技術はまだまだ未熟ですが、それを補う、はつらつとしたプレイがあります。見ていてとても感動しますし、自分も頑張らなきゃ！って気持ちにさせられます。ちなみに、長い甲子園の歴史の中で一番好きな選手は、松坂選手です。あの時代に、あそこまで完成された選手っていうのは本当に驚きです。今でこそ、150キロを投げる選手は普通にいますが、あの当時は、情報量も少なく、トレーニング環境も限られてたはずですからね。,野球
"野球が好きな理由は様々あります。魅力にもなりますが一番好きなのは守備です。好きな選手名と関連しますが『菊池涼介』選手が受けた打球を普通の選手なら取れないようなものも取り、肩も強いので後ろに守っていてもアウトに出来るのが見てて興奮します。また打者や投手の特徴により微妙に守備位置を変える工夫をし、アウトにできる確率を上げる心がけが『野球を考えてやるものだ』と再認識し私も考えながら野球を観戦する楽しみにもなります。
2番目に好きなのは采配です。監督の立場になって野球を見ることが多く、試合展開や選手の状態や日程や相手チームの選手の調子の良し悪し等、様々なことを考えて投手の続投・交代や打者への代打、代走、守備固め等を決め、勝ちにもっていくストーリーを予測するのが楽しいです。",野球
私はもともと野球に興味がありませんでした。しかy奥内選手し職場の近くに野球場があり野球観戦をしたことが野球を好きになるきっかけでした。大きな球場に日中や夕方からお酒を飲み応援する。それが一体感のあるもので初めて見に行ったのにすごく楽しむことができました。また球場周りでもいろいろなイベントをやっているのでそちらも楽しめます。野球のルールは単純なことしかわかりませんが、それでも見ていてわかりやすいので初心者でも見ていられます。新人が体格が大きくなりどんどん成長したりすると親目線で大きくなったとみてしまいます。またヒーローインタビューのコメントも楽しみの一つです。,野球
私が野球に興味を持ったきっかけは、今は亡き父親である。地元の中日ドラゴンズをこよなく愛していた父は、オープン戦からシーズン戦、春のキャンプの様子まで逐一チェックしていた。それに影響され、私も野球を見るようになり、野球の面白さにハマってしまった。今、私の好きな選手は大谷翔平である。父は「野球にはドラマがある」と言っていた。負けていても、最後の最後で1つのチャンスを生かし、チーム全員で繋いで行く逆転劇。若き新人投手がノーヒットノーランのような思いもよらない快挙を成し遂げる。勝てた試合が、小さなミスから崩れてしまう。喜怒哀楽の詰まった、同じ筋書きが１つもないドラマ。それが野球の魅力だと思う。,野球
野球の好きなところで挙げられることにドラフト会議があります。プロ野球に入るにはドラフト会議にかけられなければなりません。各球団のスカウトは全国をくまなく回り、各地のネットワークを使い、めぼしい選手を物色します。これと同時に野球ファンの中では、プロ野球に入る前の選手を独自に分析している目の肥えたファンも多いです。自らがスカウトになったつもりで甲子園や大学野球、都市対抗などを見学して、アマチュア時代から知っている選手がドラフト会議にかかり、プロ野球に入団して活躍すると何かとても嬉しい気持ちになります。,野球
"中学生まで野球部に入っていました。
辛いこともありましたが、嬉しい瞬間も多く体験できるスポーツだと思います。
打つときはいい当たりをしたとき、遠くまで飛ばせたとき、守備ではいいプレーをできたときと気持ちよさを感じます。
練習ももっと打ちたい、守備が上手くなりたいという気持ちで向上心を持ってやっていました。
プレーする側からするとチームとしてのスポーツなので同じ選手との一体感や協調性があり、誰かがミスをしても取り返せる機会が多いのも魅力です。
投手が打たれたら自分たちも打てばいいと前向きになれるところがいいなと思います。
好きな選手は鈴木誠也選手です。
打つ方はもちろんトップクラスですが、そういう選手は守備に難があったり脚が遅かったりしますが、彼の場合脚も速いですし肩も強いと素晴らしい選手だと思います。",野球
"野球の好きなところは色々ありますが中でも特に私が良いと思っているのが野球なら世代を問わずに好きという人が多くて野球について語り合う事ができるのは良いと思います。おかげで好きな野球について楽しく語ることができて一層野球が好きになったというのがあります。

また野球が良いのはプロ野球を観戦する事も楽しいのですが、自分自身も気軽にできる球技という点でも野球が好きです。
あまり運動神経が良くない私でも野球ならバットにボールを当てることさえできれば活躍できるのでその点でも私は野球が好きです。

そうやって自分自身も野球をやって楽しんで野球についてより詳しくなって野球観戦もより楽しめるのが野球の好きなところです。",野球
私は51歳の薬剤師です。私が野球の好きな理由はスポーツというよりもゲーム性が高いところに魅力を感じています。個人個人でみればスポーツになりますが、チーム全体で見ればゲームのようなもので、各個人の能力をうまくパズルのピースのように配置して勝利をもぎ取る点が大変面白いと感じています。最近はゲームをしていませんが、野球ゲームが本物の野球とあまり変わらないで楽しめるところが私の考える所以ではないかと考えています。もちろん個人としてのバッティングやスローイングなどにも追求する楽しさがあるとは思いますが、様々なピースを使って常勝チームを育て上げる点が大変魅力的です。,野球
野球と言えばスタジアムでビール片手に騒ぎながら応援するのが醍醐味だと思いますし、例え１人で観戦に行っても必ず周りの人と仲良くなれ一体化になって応援できるのはとても楽しいです。スタジアムに行けばストレス発散にもなれますし、各スタジアムにあるスタジアムグルメも野球の楽しみの一つになっています。また、やはり野球と言えばパワーのあるフルスイングのホームランは観ていてとても気持ちいいですし、監督やコーチの指示や見えないところの駆け引きなどに注目して観るのも楽しいです。テレビからでも伝わるあの雰囲気も好きです。,野球
野球は小学校の頃からやり始めましたが当初は父親に無理やりやらされた感があり楽しさ、良さが全く分かりませんでした。ただ練習をしていくにつれ試合に出れるようになりチームスポーツの良さ、勝っても負けてもチーム一丸となり勝つことに向かってやっていく楽しさが分かってきました。小さい頃から口下手であまり自分から話すことがなかったのですが野球を通じ仲間ができ野球以外のことでも大切なことが多く学べました。大人になった今でも野球での経験が活きてると思います。好きな選手は大谷翔平選手です。今彼は想像もできなかった漫画の中での出来事をされていて毎日スポーツニュースを見るのが楽しみです。,野球
"私は野球観戦が特に好きです。理由は、1球投げるごとに合間があることで、緊張感を1球ごとに感じることができるからです。ピッチャーとキャッチャーが何を考えてどの球種をどのコースに投げるのか、バッターはどの球種やコースを狙っているのか、それぞれの狙いを1球ごとに感じられ、投げるときにピッチャーとバッターどちらが勝つかの緊張感が楽しいです。野球は、前の投球が次の投球に影響を与えるため、何を意図して投げているのか、その意図をバッターが読んで狙って打っていくのかを1球ごとに考える時間があり、その時間の駆け引きと、投げてからバッターに届くまでの緊張感を同時に感じられます。
スピード感ではなくじっくりと考えつつ1球ごとの緊張感がたまらない魅力です。
いまはヤクルトの内川選手が好きです。",野球
