好きなスポーツの一つが水泳です。水泳は、自分が泳ぐのも好きですが観るのも大好きです。好きな理由は、スピーディーな展開で前半から後半にかけて各選手がデットヒートを繰り広げる展開がとても面白いからです。残り数メートルでの逆転など、最後まで気を抜く事が出来ない展開が面白いところです。選手の日頃の練習の成果が思いっきり出る競技のため、選手がどれだけ努力したか良く分かるところが魅力でもあります。そんな、水泳で好きな選手は入江選手です。背泳ぎのオリンピック銀メダリストで現在でも、活躍されており東京オリンピックでもメダルが期待できます。,水泳
好きなスポーツは野球です。なぜ好きなのかですが、元々高校野球が大好きで甲子園はセンバツや夏の大会など欠かさずに観戦しています。なぜ好きかですが、野球は9人で行うスポーツですが監督やコーチ、控えの選手までみんなで戦う姿やチームワークの大切さがより分かるためです。また、最後の一球まで何が起こるか分からないのが野球の面白さでもあります。高校野球でもプロ野球でも大逆転劇があって、最後まで緊迫感のある試合が観られるのはとても魅力的です。野球選手で好きな選手は、メジャーでも活躍している大谷選手です。二刀流でメジャーを沸かす選手へと成長していってほしいです。,野球
競泳が好きです。短時間で決着がつきますが、タイムで競うので勝敗が公平だからです。また自分も水泳が好きなので見ていて泳ぎたくなります。選手はみんなフォームがきれいで、大変参考になります。自分も真似したくなります。プールの水を見るだけで癒されますし、選手の鍛え抜かれた体を見ることができるのも魅力だと思います。好きな選手は池江璃花子選手です。白血病の克服だけでも大変なのに、選手として復帰したのにはすごく感動し、涙が出ました。スポーツでこれほどまでに感動したのは初めてです。努力が報われて本当に良かったと思います。,競泳
好きなスポーツは硬式テニスです。好きな理由として、緩急つけたメリハリのある連続したラリーです。その最大の魅力は、お互いのプレーヤーの駆け引きや心理作戦です。相手のうらを読んで、意表をついたり、思わず息を呑むようなプレーは見ている観客としても楽しめます。奥に打つふりをして、ドロップショットするなど多彩なプレーに見惚れます。また錦織圭選手の、もう届かなくてかえせないだろうというボールでも、股打ちで返してしまったりなど、芸術的なプレーが見れるところも魅力の一つです。他にも好きな選手として、大阪なおみ選手のような感情をプレーに表現してゲームをしているのも非常に見応えがあります。,テニス
私が好きなスポーツはずばり「スティールチャレンジ」です。私が「スティールチャレンジ」を好きな理由は2つあります。1つは他の射撃競技と比べてとてもすばやくわかりやすいからです。そもそもスティールチャレンジは5枚の板を拳銃で早撃ちする競技です。そのため長距離射撃をするライフル射撃や飛んでくる皿を撃つクレー射撃よりもすばやく終わります。2つ目はエアガンで参加できることです。日本で行われているJapan steel challengeではガスガンで競技を行います。そのため他の射撃競技よりも参加へのハードルが低いと思われます。しかしながら競技自体はとても真剣に行われていて見ごたえがあります。これらが私がスティールチャレンジが好きな理由と競技の魅力です。好きな選手はマック堺です。この選手はアメリカでの実銃を使った大会でも優勝していて実力があります。,スティールチャレンジ
私が好きなスポーツは卓球です。自分が学生時代に卓球をやっていたこともあり、いつのまにか好きになっていたスポーツです。なぜ好きかと言われると良く分かりませんが、カッコいいだけではなく、どことなく可愛らしさがあるところだと思っています。国際大会などは特に興味があります。特に最近はオリンピックでも日本の選手が活躍していて、以前よりもテレビ中継がかなり増えたことが嬉しいです。応援したい選手はたくさんいますが、中でも石川佳純選手は特に注目しています。男子の卓球はとてもパワフルで、ラリーのやり取りなども凄いので、女子とは違った面白さがあります。卓球の魅力はやはり瞬発力の速さかもしれません。卓球のイメージが今はカッコよく、オシャレになってきているのが嬉しいです。　　　,卓球
好きなスポーツは卓球です。好きな理由としては、目にもとまらぬ速さで行われるところです。最大の魅力は変化球です。サーブ一つにも様々なサーブがあり、縦回転や横回転など変化球は多々あり、そのテクニックには感嘆します。しかし、サーブだけでなく、サーブレシーブも変化させてリターンするところも魅力的です。サーバーからしたら、まさか変化球を変化球で返球するとは思わないので、意表をつかれて呆気に取られます。観ている観客もその技能と頭脳戦に惹かれていくところが、とても魅力的です。好きな選手には石川佳純選手がいます。日本代表としてチームキャプテンとして、一生懸命プレーしているところに心打たれます。,卓球
私はスキーのジャンプも大好きです。あの短時間で高いジャンプ台から飛び出す姿は大空をまう鳥のようで、本当に素晴らしいと思います。私は実際にジャンプの試合を見たことがありますが、素晴らしい迫力でした。またジャンプしている姿も美しかったですね。特に２回目のジャンプは緊張感が半端なかったです。本当に素晴らしいスポーツです。好きな選手は高梨沙羅選手ですね。あの小柄な体型で世界を相手に戦っています。誰にも真似できない事だと思いましたね。またいつまでも飛び続ける船木和喜選手も飛型で本当に素晴らしいと思います。,スキーのジャンプ
私が好きなスポーツはフィギュアスケートです。なぜなら華やかで美しく、短時間で終わる競技なのに、ドラマ性があるからです。そもそも私がフィギュアスケートにハマった理由は、子供の頃NHKで女子フィギュアスケーターが、可愛いひらひらの衣装で競技をしている姿が素敵で羨ましく印象に残ったからです。 その後スケートリンクで実際に滑ってみましたが、ぎこちなく滑るだけで精一杯でした。 それなのにフィギュアスケート選手は滑らかに滑り、時にはアクロバティックな技を見せ、観客を魅了します。 またフィギュアスケートはスポーツでありながら芸術性があり、美しい曲にあわせて踊る姿にはアートを感じます。 近年では日本人選手の活躍も目覚ましく、羽生選手の演技は滑らかで美しく、一見の価値があります。,フィギアスケート
フィギュアスケートも冬のスポーツの中では好きですね。優雅なプログラムは見ていて魅了されます。そして最大の店番であるジャンプは見ていて迫力がありますね。ジャンプが成功した時には、本当に素晴らしい笑顔を見ることができます。またエキシビションもフィギュアスケートの魅力ですね。戦い終えた後の選手が思い思いのコスチュームで自由に演技します。まるでおとぎ話の世界に引き込まれていくようです。なかなか他のスポーツでは見ることができないのもフィギュアスケートのエキシビションですね。好きな選手は羽生結弦選手ですね。,フィギアスケート
好きなスポーツはバスケットボールです。日本ではまだまたまマイナーなスポーツですが、アメリカでは絶大な人気があります。日本とは比べ物にならないほどの身体能力やスキルを持った選手が多数座席しており、試合展開の早さやダンクシュートは観ていてとても興奮させてくれます。ライバル関係がある球団のプレイオフでは選手やファンが乱闘騒ぎを起こすほど熱狂的な試合展開になります。ロサンゼルスレイカーズに所属しているコービーブライアントの大ファンでしたが、昨年不運な飛行機事故で亡くなってしまい、その悲しみが今も消えません。私にとってバスケットボールを好きになるきっかけとなった選手でありこれからも永遠にファンを貫き通したいと思います。,バスケットボール
競馬ですね。日本ダービーや天皇賞などのレースに出場し、そこで好成績を収めることでさらにファンが増えたりしていく。  　そのレースにおいて、「逃げ」「先行」「差し」「追込」の中から、運営がどう走るのか作戦を選び実際にレースが始まってしまえば、育ててきたウマの力のみが順位が決まる。  　「レースは見ているだけ」実際にレースを見てみると、これがまあおもしろい。ナリタブライアンが、好きです。馬にはそれぞれドラマがあり引退後にも種馬としての世界があるので、一度ファンになると死ぬまで追い続けてしまうことになる。,競馬
スポーツの中で1番好きなものはバスケットボールだ。なぜバスケが好きなのか、それは何と言ってもプレーしていて楽しいからだ。5人全員でゴールを目指しゴールにボールを叩き込む、単純ではあるが仲間との一体感を感じることができとても楽しい。そして誰しもがゴールを決めるチャンスがあることも魅力的だ。ゴールに向かって切り込んでいって点数を取ったり、ゴールから離れていたってシュートを決めることができる。一人一人に活躍するチャンスがあるのだ。もちろん、観戦するのもおもしろい。攻守の切り替えが早く、得点がどんどん入り、100点台になる事もある。その展開の速さと疾走感は観ていて飽きることはない。そんなバスケットの最高峰、NBAで日本人で初めてプレーしたのが田臥勇太選手であり、私が一番好きな選手だ。小柄ながらパスのセンスは天才的だった。ずっと観ていられる選手だったと思う。,バスケットボール
まだまだマイナーな競技ですが、オリンピック種目でもある、フィールドホッケーが好きです。自分もやっていたということが最大の要因ですが、スピード感がすごく、見ていてたのしいです。また、トリッキーなプレイもたくさん見れるし、プロになると細やかな技と一体感でずっとみていられます。また、とにかくユニフォームが可愛いところも魅力です。ピンクのミニスカート、テニス風です。日焼けもしていて、歯が白く笑うと可愛い人が多いです。個人的には、永井葉月選手が好きです。私がまだ選手だった頃から、話題の選手で鮮やかなプレーが印象的です。もっともっと、人気になって欲しいスポーツです。,フィールドホッケー
私は小さい頃からサッカーをやっていました。好きな理由としましては、やはり小さい頃にワールドカップをみて、自分もこんなふうに活躍したいと思っていました。またどの団体競技でもそうなのですが、サッカーを通じて色々な友達ができ、大人になった今でもサッカーを通じて新たな仲間を作ることができました。また、海外サッカーを観るのも好きですが、Jリーグ観戦もコロナの影響でなかなか行けませんが、以前はよくいってました。チーム競技なので、みんなの協力がないとプレーできない為、話合う重要性を学びました。これからもサッカーを続けて行きたいと思います。好きなサッカー選手は特にいませんが、目標としていた選手は横浜ＦＣの中村俊輔選手です。,サッカー
好きなスポーツと言えばメジャーですが野球です。プロ野球や高校野球などはテレビなどで同じみなのでプロ野球について語ります。まずプロ野球で魅力を感じるのは、チームワークは当たり前ですが、個人の技術が相当なものです。実際ひとりひとりが全ての役割を実行し体と頭脳を駆使して相手の裏をかき得点を重ねていくのです。ピッチャーの球種も様々あるのでバッターは球種を読みながら攻略していく。攻略しながらランナーを進めて得点をあげるところが野球が好きな理由です。プロともなればある意味有料でお客様を入れてるので、選手も魅せる野球を心がけてくれる所も醍醐味のひとつです。好きなプロ野球選手は今は引退しておりますが清原和博選手がやはり一番好印象です。,野球
私が好きなスポーツはゴルフです。社会人になり上司に連れられてラウンドしたのをきっかけに、今では月1回はラウンドするほどハマってしまいました。運動神経や年齢によってスコアが左右されるわけではなく、若年層から高齢者まで一緒に楽しめるスポーツです。初めてお会いする人でもゴルフを共にすると自然と打ち解けてしまうのも魅力的な部分だと思います。長い年月を経て上達するスポーツなので飽きることなくどこまでも向上心を持って取り組めるスポーツだと感じています。道具もさまざまな種類があり自分に合ったセッティングを探すのも楽しいです。石川遼選手が好きで彼が出ているテレビ版組は欠かさずチェックするほど大ファンです。,ゴルフ
バレーボールです。チームワークが大切な競技ですが、一人一人の役割がしっかりと明確になっています。最近バレー漫画が流行りましたが漫画では表せることのできない会場の熱気とボールの速さ、そして選手の動体視力は圧巻です。ボールを長く持ってはいけない、一度に3度しか触れることのできない、ポジションにも制約があるといったいらいらな要素が詰まっています。何より上を向くスポーツであり、常に上に飛ぶスポーツで重力との戦いです。選手は重力と戦い常に上を目指すのです。日本人は身長が低く世界に通用するには壁が高いです。そんな中負けずに世界を圧倒しています。男子バレーの越前選手はサーブが強みの選手です。力強いサーブは是非一度見ていただきたいです。,バレーボール
好きなスポーツはサッカーです。なぜなら波乱が多くて見ていて面白いからです。私はJリーグより日本代表の試合を見ることが多いです。最近の日本代表のレベルは確実に上がっていると思います。海外で活躍できる日本人が増えていることは嬉しい限りです。次のワールドカップで日本代表が波乱を起こす可能性は十分にあると思います。なぜなら決定力不足は少しずつ解消されていて攻守のバランスが良くなっていると感じるからです。以前は期待できる選手が少なかったですが、最近は選手層が厚くなっているため特に期待できる選手はと聞かれても悩む程です。私が好きな選手をあげるとすれば南野選手です。なぜなら毎試合得点に絡んでいるし、特にアジアカップのイラン戦で倒されてもすぐに立ち上がってボールを追いかける姿勢に好感が持てました。これからも日本代表を応援していきたいと思います。,サッカー
私が魅力を感じているスポーツはバレーボールです。小学生のときに友達に誘われて始めたバレーボールでしたが、これ以上に没頭したスポーツはないと思います。個人的にはやはり団体スポーツは魅力的に感じます。その中でもこの競技は3回しかボールに触ることができない中で仲間とボールを繋ぎ、そこから得点したときの喜びは他に変えられるものはありません。得点のあとに仲間と喜びを共有し、絆を深め合うという魅力的なスポーツです。10年以上バレーボールを続けていますが、私の憧れの選手は清水邦洋選手です。一番の魅力はあの背筋です。私もがっちり体型ですので、あのような選手になりたいとずっと思っていました。,バレーボール
好きなスポーツは野球です。特にプロ野球をよく見ます。なぜなら、シーズンを通して100試合以上戦い、最後のクライマックスが一番面白いからです。優勝が決まったときは見ていて鳥肌が立ちます。その後クライマックスシリーズを戦いますが、優勝したチームが敗れることがあるのが怖いところでもあり面白さでもあると思います。その後日本シリーズがあり私は何度か見に行ったことがありました。自分が応援しているチームが日本シリーズに行くことはめったにないので貴重な経験になりました。特に印象に残っているのが2013年に楽天と巨人が戦った日本シリーズです。特にマー君の活躍が印象に残っています。マー君は高校時代から見ていて私の中では好きな選手の一人です。日本シリーズで完投した翌日にクローザーで登板し日本一になった感動は今でも忘れられません。私の中では今までで1番の日本シリーズでした。,野球
フィギュアスケートが好きです。理由は3点あります。1つ目は、観ていてとても美しいスポーツだからです。華麗なステップとジャンプは自分ではとても出来ないので、憧れます。2つ目は、競技の衣装が華やかで美しく、見応えがある点です。特に女性の衣装は選手の個性が出ていて、見ていて楽しいです。3つ目は魅力的な選手がいることです。特に羽生結弦選手がとても好きです。はじめてロミオとジュリエットの演技を観て衝撃を受けました。それからファンになり、今でも応援しています。彼の演技は美しいだけでなく、人に勇気と感動を与える素晴らしいものだと思います。,フィギアスケート
サッカーも実はかなり大好きです。何故大好きなのかというと、強いチームが必ず勝利するわけではないからです。そして美しいパス回しからのゴールは本当に美しいのもあります。また後半のロスタイムになると、負けているチームプレーがパワープレーを仕掛けてきますが、その際の攻防の迫力は本当に素晴らしいです。格闘技と言っても間違いないくらいですね。好きな選手は三浦知良ですね。あの諦めない姿は本当に尊敬します。またDFの吉田麻也選手もイングランドプレミアリーグでバリバリ活躍しており、本当に素晴らしい選手だと思いますね。,サッカー
冬季五輪で楽しみにしている「スキージャンプ」。アルベールビルやリレハンメルの頃からよく見ていました。白一色の景色と飛行の景観が魅力でした。ちょうどその頃はノルディック競技における日本人選手の活躍が目覚ましかった頃です。現在もその傾向は継承されており、現役選手は皆優秀です。ただし、本番の五輪メダルは取り逃がしているのが残念。大好きな選手である高梨沙羅選手は、まだあどけない小さな女の子だった頃から見ていたため、色々な思いを感じます。例えば、TV中継を見ていて、あの沙羅ちゃんがお化粧をしておりマスカラしていることに驚き、バラエティ番組の出演を見ては、オフショルダー(両肩の出た)のトップスを着用しているのにまた驚き。大人になって、女の子らしくを通り越し女性になったんだなあ…と思うことしきりです。しかもレジエンドは今、かつての新人葛西選手ですよ!と気が立つのが早すぎる。,スキー
筋トレが好きです。もともとジムに通っていて、はじめはマシンでトレーニングをしていましたが、だんだん飽きてきてフリーウェイトの世界へ…腰ベルトやグローブを購入して、BCAAやプロテインを飲んで、少しだけ本格的に取り組みました。正しいフォームで、かつ重量を上げていけるとやはり楽しくなってきます。私は筋トレ＆ランニング＆少しの食事制限で、体脂肪率が7%くらい落ちました（20%?13%)。やはりに筋肉は裏切らない！好きな選手は安井友梨さんです。真面目で努力家で、仕事もしつつ家庭も支えつつあの身体を維持しているのは本当に憧れます。,筋トレ
私の好きなスポーツはトライアスロンです。皆さんはトライアスロンにどんなイメージをお持ちでしょうか？やはり「鉄人」とか「過酷な競技」という言葉を思い浮かべるかもしれませんね。トライアスロンは、スイム、バイク、ランを連続して行う競技で、確かに体力的にはハードです。しかし！その最大の魅力は完走したときの達成感です！これはトライアスロン経験者がみんな感じることで、レースでは完走者が「勝利者」とも言われます。またもうひとつの魅力が、競技の戦略性の高さがあります。普段の練習やレースでは、体調や天候など、あらゆる状況を踏まえながらプランを立てたりします。トライアスロンは企業経営者にとても人気がある競技だと言われています。マネジメント能力の高さが求められるという特徴に経営者の方々は魅力を感じるのではないでしょうか。現在の日本人選手では、上田藍さんがとても小さい体ですが頑張っていて、応援したくなりますよ！,トライアスロン
私が好きなスポーツはずばり「総合格闘技」です。私が「総合格闘技」を好きな理由は2つあります。1つは他の格闘技にはないアグレッシブさです。金的、頭突き、後頭部、脊椎、眼球以外の攻撃は基本的に何をしてもいいというルールゆえに見ごたえがあります。例えばボクシングのパンチよりも繊細さはないですが破壊力はあります。これは使用しているグローブの種類が違うためです。このように他の格闘技よりも危険なものの迫力があるところが私は好きです。2つ目は試合のわかりやすさです。ボクシングは1試合10～12ラウンドであったり、柔道では組手争いなど少々グダグダしたり経験者でないとわかりにくかったりすることがあります。しかし総合格闘技は多種多様な戦い方のためわかりやすいです。これらが好きな理由と魅力です。好きな選手は海外だとトニー・ファーガソン、日本だと堀口恭司です。,総合格闘技
